{
  "$schema": "https://json-schema.org/draft/2020-12/schema",
  "$id": "https://urd.dev/schema/plugin.schema.json",
  "title": "Urd plugin manifest (plugins/<id>/plugin.json)",
  "description": "Manifest for an Urd plugin. The plugin's entry is an ES module that exports register(Urd) and uses the same define APIs as the core - including the migration contract. See docs/SCHEMA.md.",
  "type": "object",
  "required": ["id", "name", "version", "requiresEngine"],
  "allOf": [
    {
      "$comment": "entry and provides are required for anything but a pure language pack, which has no code to run.",
      "if": { "not": { "required": ["languages"], "properties": { "languages": { "type": "array", "minItems": 1 } } } },
      "then": { "required": ["entry", "provides"] }
    }
  ],
  "additionalProperties": false,
  "properties": {
    "id": { "type": "string", "pattern": "^[a-z0-9][a-z0-9-]*$" },
    "name": { "type": "string", "minLength": 1 },
    "version": {
      "type": "string",
      "pattern": "^\\d+\\.\\d+\\.\\d+$",
      "description": "Semver for the plugin itself"
    },
    "requiresEngine": {
      "type": "string",
      "minLength": 1,
      "description": "Semver range for compatible engine versions, e.g. \">=0.1.0 <1.0.0\""
    },
    "entry": { "type": "string", "pattern": "\\.js$" },
    "names": {
      "type": "object",
      "description": "Optional (additive from 0.6.8): display name per admin language (ADR-0012). Key = language code (nb/nn/en-GB/se/tr), value = name; admin shows names[admin language] with name as fallback.",
      "additionalProperties": false,
      "patternProperties": {
        "^[a-zA-Z-]+$": { "type": "string", "minLength": 1 }
      }
    },
    "locales": {
      "type": "boolean",
      "description": "Optional (additive from 0.6.8): true promises locales/{nb,nn,en-GB,se,tr}.js with the plugin's texts (ADR-0012). The loader puts them in the visitor registry (the site language) and in preview also in the admin registry; the parity test keeps the files in sync."
    },
    "languages": {
      "type": "array",
      "description": "Optional (additive from v0.6): languages the plugin delivers as a LANGUAGE PACK (ADR-0012). Each entry promises locales/site/<code>.js and/or locales/admin/<code>.js. A pack cannot override Urd's built-in languages (nb, nn, en-GB, se, tr), and a pure language pack needs neither entry nor provides.",
      "items": {
        "type": "object",
        "required": ["code", "name"],
        "additionalProperties": false,
        "properties": {
          "code": {
            "type": "string",
            "pattern": "^[a-z]{2,3}(-[A-Za-z0-9]{2,8})*$",
            "not": { "enum": ["nb", "nn", "en-GB", "se", "tr"] },
            "description": "The language code (BCP 47), e.g. \"sv\" or \"pt-BR\". Urd's built-in languages cannot be overridden by a plugin."
          },
          "name": {
            "type": "string",
            "minLength": 1,
            "description": "The language's OWN name (endonym), shown in the language pickers"
          },
          "site": { "type": "boolean", "description": "The pack covers the visitor texts (locales/site/<code>.js)" },
          "admin": { "type": "boolean", "description": "The pack covers the admin chrome (locales/admin/<code>.js)" }
        },
        "anyOf": [
          { "required": ["site"], "properties": { "site": { "const": true } } },
          { "required": ["admin"], "properties": { "admin": { "const": true } } }
        ]
      }
    },
    "csp": {
      "type": "object",
      "description": "Optional (additive from v0.6): external origins the plugin needs CSP exceptions for. _headers is never changed automatically; admin shows the need to the owner (see ADR-0006).",
      "additionalProperties": false,
      "properties": {
        "connectSrc": { "$ref": "#/$defs/originList" },
        "frameSrc": { "$ref": "#/$defs/originList" }
      }
    },
    "provides": {
      "type": "object",
      "additionalProperties": false,
      "properties": {
        "blocks": { "$ref": "#/$defs/idList" },
        "sectionPresets": { "$ref": "#/$defs/idList" },
        "backgrounds": { "$ref": "#/$defs/idList" },
        "animations": { "$ref": "#/$defs/idList" },
        "templates": { "$ref": "#/$defs/idList" },
        "commands": { "$ref": "#/$defs/idList", "$comment": "Commands for the editor's command palette (Urd.commands), additive from 0.7.10.16." },
        "maler": { "$ref": "#/$defs/idList", "$comment": "The legacy name for templates (ADR-0021); still read, not written in new manifests." }
      }
    }
  },
  "$defs": {
    "originList": {
      "type": "array",
      "items": { "type": "string", "pattern": "^https://[a-z0-9.-]+$" }
    },
    "idList": {
      "type": "array",
      "items": { "type": "string", "pattern": "^[a-z0-9][a-z0-9-]*$" }
    }
  }
}
