{
  "id": "kalender",
  "name": "Kalender",
  "names": {
    "nb": "Kalender",
    "nn": "Kalender",
    "en-GB": "Calendar",
    "se": "Kaleandar",
    "tr": "Takvim"
  },
  "locales": true,
  "version": "1.0.0",
  "requiresEngine": ">=0.5.0 <1.0.0",
  "entry": "index.js",
  "provides": {
    "blocks": [
      "kalender"
    ],
    "sectionPresets": [
      "hva-skjer"
    ],
    "backgrounds": [],
    "animations": [],
    "maler": []
  }
}
