{
  "id": "skjema",
  "name": "Skjema",
  "names": {
    "nb": "Skjema",
    "nn": "Skjema",
    "en-GB": "Form",
    "se": "Skovvi",
    "tr": "Form"
  },
  "locales": true,
  "version": "1.0.0",
  "requiresEngine": ">=0.5.0 <1.0.0",
  "entry": "index.js",
  "provides": {
    "blocks": [
      "skjema"
    ],
    "sectionPresets": [
      "kontaktskjema"
    ],
    "backgrounds": [],
    "animations": [],
    "maler": []
  }
}
